<?xml version="1.0" encoding="UTF-8" standalone="yes"?>
<mappings xmlns="http://java4cpp.loicoudot.github.com"
	xmlns:xsi="http://www.w3.org/2001/XMLSchema-instance"
	xsi:schemaLocation="http://java4cpp.loicoudot.github.com http://raw.github.com/loicoudot/java4cpp-core/master/mappings.xsd">
	<namespaces>
		<namespace package="com.github.loicoudot">java4cpp</namespace>
		<namespace package="java.utils.*">utils</namespace>
	</namespaces>
	<classes>
		<class superclass="true" interfaceAll="true" exportFields="true"
			exportAll="false" class="java.lang.Float">
			<cppName>cppName</cppName>
			<interfaces>
				<noWrappes>
					<noWrappe>Interface1</noWrappe>
					<noWrappe>Interface2</noWrappe>
				</noWrappes>
				<wrappes>
					<wrappe>com.github.loicoudot.java4cpp.Empty1</wrappe>
					<wrappe cppName="cppInterface">Interface2</wrappe>
				</wrappes>
			</interfaces>
			<innerClasses>
				<noWrappes>
					<noWrappe>noWrappe1</noWrappe>
				</noWrappes>
				<wrappes>
					<wrappe cppName="cppInner">Inner1</wrappe>
				</wrappes>
			</innerClasses>
			<staticFields>
				<noWrappes>
					<noWrappe>field1</noWrappe>
				</noWrappes>
				<wrappes>
					<wrappe cppName="fieldCpp">staticField1</wrappe>
				</wrappes>
			</staticFields>
			<constructors>
				<noWrappes>
					<noWrappe>noWrappe1</noWrappe>
					<noWrappe>noWrappe2</noWrappe>
				</noWrappes>
				<wrappes>
					<wrappe cppName="cppName"></wrappe>
					<wrappe>wrappe2</wrappe>
				</wrappes>
			</constructors>
			<methods>
				<noWrappes>
					<noWrappe>method2()</noWrappe>
				</noWrappes>
				<wrappes>
					<wrappe>method1()</wrappe>
				</wrappes>
			</methods>
		</class>
	</classes>
	<keywords>
		<keyword>true</keyword>
		<keyword>delete</keyword>
	</keywords>
</mappings>
